<?xml version="1.0"?><!--Version of xml used-->
<Root xsi:noNamespaceSchemaLocation="Favorite_recipe.xsd" xmlns:xsi="http://www.w3.org/2001/XMLSchema-instance"><!--Declaration of the schema which validate this xml file-->
	<Favorite>
		<Recipe>Boeuf Bourguignon</Recipe>
		<Note>4 starts</Note>
		<Category>Traditional</Category>
		<Level>easy</Level>
		<Total_time>5 hour</Total_time>
		<Budget>60 Eur</Budget>
	</Favorite>
	<Favorite>
		<Recipe>Chocoloat cake</Recipe>
		<Note>5 starts</Note>
		<Category>Traditional</Category>
		<Level>easy</Level>
		<Total_time>40 min</Total_time>
		<Budget>10 Eur</Budget>
	</Favorite>
	<Favorite/><!--Empty element because it doesn't complete the if condition in the xslt-->
	<Favorite>
		<Recipe>Gaspacho</Recipe>
		<Note>5 starts</Note>
		<Category>World flavors</Category>
		<Level>middle</Level>
		<Total_time>15 min</Total_time>
		<Budget>25 Eur</Budget>
	</Favorite>
	<Favorite/>
	<Favorite/>
	<Favorite>
		<Recipe>Raspberry foam</Recipe>
		<Note>5 starts</Note>
		<Category>Light</Category>
		<Level>expert</Level>
		<Total_time>22 min</Total_time>
		<Budget>20 Eur</Budget>
	</Favorite>
	<Favorite/>
</Root>
